class_year,degrees,scraped_linkedin,link,major,name
'18,"[""SB - Bachelor Of Science""]","{""company"": ""Tau Motors"", ""company_description"": ""Coming soon."", ""company_industry"": ""Motor Vehicle Manufacturing"", ""company_website"": ""http://taumotors.com"", ""experiences"": [{""company"": ""Tau Motors"", ""company_id"": ""18379481"", ""company_linkedin_url"": ""https://www.linkedin.com/company/18379481"", ""company_logo_url"": ""https://media.licdn.com/dms/image/v2/C560BAQHq7Yh9_28V8Q/company-logo_200_200/company-logo_200_200/0/1630662914605/taumotors_logo?e=1739404800&v=beta&t=wq7Dj9orv97rMyJK3pWViuTS_G7gYHmoeinlfXwT3E0"", ""date_range"": ""Sep 2021 - Present"", ""description"": ""- motor characterization and validation\n- high power test stand design, build, and validation"", ""duration"": ""3 yrs 3 mos"", ""end_month"": """", ""end_year"": """", ""is_current"": true, ""job_type"": ""Full-time"", ""location"": ""Redwood City, California, United States \u00b7 On-site"", ""skills"": """", ""start_month"": 9, ""start_year"": 2021, ""title"": ""Mechatronics Engineer""}, {""company"": ""Tau Motors"", ""company_id"": ""18379481"", ""company_linkedin_url"": ""https://www.linkedin.com/company/18379481"", ""company_logo_url"": ""https://media.licdn.com/dms/image/v2/C560BAQHq7Yh9_28V8Q/company-logo_200_200/company-logo_200_200/0/1630662914605/taumotors_logo?e=1739404800&v=beta&t=wq7Dj9orv97rMyJK3pWViuTS_G7gYHmoeinlfXwT3E0"", ""date_range"": ""Jun 2020 - May 2021"", ""description"": ""- Electromechanical model evaluation\n- Centralized our documentation to improve ease of finding internal information."", ""duration"": ""1 yr"", ""end_month"": 5, ""end_year"": 2021, ""is_current"": false, ""job_type"": ""Internship"", ""location"": ""San Carlos, California, United States"", ""skills"": """", ""start_month"": 6, ""start_year"": 2020, ""title"": ""Engineering Intern""}, {""company"": ""Optimus Ride"", ""company_id"": ""10459493"", ""company_linkedin_url"": ""https://www.linkedin.com/company/10459493"", ""company_logo_url"": ""https://media.licdn.com/dms/image/v2/C4D0BAQEZp1oB4vKzPQ/company-logo_200_200/company-logo_200_200/0/1630550867201/optimus_ride_logo?e=1739404800&v=beta&t=1HMfcZ13E5OTFKhZqXOkgRofxpOOuY88Cn4fMPf8Eso"", ""date_range"": ""Mar 2019 - Aug 2019"", ""description"": ""Incorporated DOE principles to develop a coverage-based scenario testing framework for system-level testing."", ""duration"": ""6 mos"", ""end_month"": 8, ""end_year"": 2019, ""is_current"": false, ""job_type"": """", ""location"": ""Greater Boston Area"", ""skills"": """", ""start_month"": 3, ""start_year"": 2019, ""title"": ""Systems Integration Engineer""}, {""company"": ""McLaren Applied Technologies"", ""company_id"": ""3150177"", ""company_linkedin_url"": ""https://www.linkedin.com/company/3150177"", ""company_logo_url"": ""https://media.licdn.com/dms/image/v2/C4D0BAQFU9nHso85JOQ/company-logo_200_200/company-logo_200_200/0/1630497669620/mclaren_applied_technologies_logo?e=1739404800&v=beta&t=1r4QyrFboRdX_sH2CPSq-VwgG1iehA9sXqZboJpHyT0"", ""date_range"": ""Jul 2018 - Dec 2018"", ""description"": ""Controls R&D on McLaren's road car vehicle dynamics simulator."", ""duration"": ""6 mos"", ""end_month"": 12, ""end_year"": 2018, ""is_current"": false, ""job_type"": """", ""location"": ""London, UK"", ""skills"": """", ""start_month"": 7, ""start_year"": 2018, ""title"": ""Simulation Engineer Intern""}, {""company"": ""General Motors"", ""company_id"": ""1472"", ""company_linkedin_url"": ""https://www.linkedin.com/company/1472"", ""company_logo_url"": ""https://media.licdn.com/dms/image/v2/C4D0BAQGi5bqIMQIO6g/company-logo_200_200/company-logo_200_200/0/1644857989078/general_motors_logo?e=1739404800&v=beta&t=_ul2cbhYFFT7C0J1DJzyjDLKG3yGfINQPBi-mcpYaqQ"", ""date_range"": ""Jun 2017 - Aug 2017"", ""description"": ""Intern within the Chevrolet Performance Group at the Milford Proving Grounds. Projects ranged from power based noise reduction to characterizing ride & handling and noise & vibration issues."", ""duration"": ""3 mos"", ""end_month"": 8, ""end_year"": 2017, ""is_current"": false, ""job_type"": """", ""location"": ""Milford, MI"", ""skills"": """", ""start_month"": 6, ""start_year"": 2017, ""title"": ""Vehicle Performance Intern""}, {""company"": ""General Motors"", ""company_id"": ""1472"", ""company_linkedin_url"": ""https://www.linkedin.com/company/1472"", ""company_logo_url"": ""https://media.licdn.com/dms/image/v2/C4D0BAQGi5bqIMQIO6g/company-logo_200_200/company-logo_200_200/0/1644857989078/general_motors_logo?e=1739404800&v=beta&t=_ul2cbhYFFT7C0J1DJzyjDLKG3yGfINQPBi-mcpYaqQ"", ""date_range"": ""Jun 2016 - Aug 2016"", ""description"": ""Intern within the Chevrolet Performance Group at the Milford Proving Grounds. Focused on noise and vibration performance testing. Also monitored multiple vehicle configurations undergoing track testing before post-processing and analyzing data."", ""duration"": ""3 mos"", ""end_month"": 8, ""end_year"": 2016, ""is_current"": false, ""job_type"": """", ""location"": ""Milford, MI"", ""skills"": """", ""start_month"": 6, ""start_year"": 2016, ""title"": ""Vehicle Performance Intern""}, {""company"": ""Competition Suspensions Incorporated"", ""company_id"": """", ""company_linkedin_url"": """", ""company_logo_url"": """", ""date_range"": ""Jun 2014 - Jun 2014"", ""description"": ""A summer internship focused on auto racing shock design and production. Worked alongside the shock building team, preparing components, building shocks, and aiding with final shock tuning. Complementing the in-house experience, the internship also entailed traveling to many racing venues to provide trackside support at large events, which included rebuilding broken shocks, testing problematic shocks on the dynamometer, and speaking with potential customers while at the tracks."", ""duration"": ""1 mo"", ""end_month"": 6, ""end_year"": 2014, ""is_current"": false, ""job_type"": """", ""location"": ""Brownsburg, IN"", ""skills"": """", ""start_month"": 6, ""start_year"": 2014, ""title"": ""Intern""}]}",https://www.linkedin.com/in/will-harvey-40b20777/,Mechanical Engineering,Mr. William Harvey
'19,"[""SB - Bachelor Of Science""]","{""company"": ""SpaceX"", ""company_description"": ""SpaceX designs, manufactures and launches the world\u2019s most advanced rockets and spacecraft. The company was founded in 2002 by Elon Musk to revolutionize space transportation, with the ultimate goal of making life multiplanetary. \r\n\r\nSpaceX has gained worldwide attention for a series of historic milestones. It is the only private company ever to return a spacecraft from low-Earth orbit, which it first accomplished in December 2010. The company made history again in May 2012 when its Dragon spacecraft attached to the International Space Station, exchanged cargo payloads, and returned safely to Earth \u2014 a technically challenging feat previously accomplished only by governments. Since then Dragon has delivered cargo to and from the space station multiple times, providing regular cargo resupply missions for NASA.\r\n\r\nFor more information, visit www.spacex.com."", ""company_industry"": ""Aviation and Aerospace Component Manufacturing"", ""company_website"": ""http://www.spacex.com"", ""experiences"": [{""company"": ""SpaceX"", ""company_id"": ""30846"", ""company_linkedin_url"": ""https://www.linkedin.com/company/30846"", ""company_logo_url"": ""https://media.licdn.com/dms/image/v2/C560BAQEbqLQ-JE0vdQ/company-logo_200_200/company-logo_200_200/0/1630604387686/spacex_logo?e=1739404800&v=beta&t=JDMr1FBxIJz9YSv0njSCX5bYgA4VVs2SiOo2-qvKpwI"", ""date_range"": ""May 2021 - Present"", ""description"": """", ""duration"": ""3 yrs 7 mos"", ""end_month"": """", ""end_year"": """", ""is_current"": true, ""job_type"": """", ""location"": """", ""skills"": """", ""start_month"": 5, ""start_year"": 2021, ""title"": ""Structures Engineer""}, {""company"": ""Lockheed Martin"", ""company_id"": ""1319"", ""company_linkedin_url"": ""https://www.linkedin.com/company/1319"", ""company_logo_url"": ""https://media.licdn.com/dms/image/v2/C4E0BAQHF1YKEZdN4LA/company-logo_200_200/company-logo_200_200/0/1668532986109/lockheed_martin_logo?e=1739404800&v=beta&t=-joa5GT36hS82qtY6Tt34sbFsTVVnE7a9U1-JXkck20"", ""date_range"": ""Jul 2019 - May 2021"", ""description"": """", ""duration"": ""1 yr 11 mos"", ""end_month"": 5, ""end_year"": 2021, ""is_current"": false, ""job_type"": """", ""location"": ""San Francisco Bay Area"", ""skills"": """", ""start_month"": 7, ""start_year"": 2019, ""title"": ""GNC Engineer""}, {""company"": ""MIT Motorsports"", ""company_id"": ""27117585"", ""company_linkedin_url"": ""https://www.linkedin.com/company/27117585"", ""company_logo_url"": ""https://media.licdn.com/dms/image/v2/D4E0BAQH_ornkC73C3w/company-logo_200_200/company-logo_200_200/0/1692246910340/mitmotorsports_logo?e=1739404800&v=beta&t=XvqkZ3PJpeoYflktiSFuYFOkviixxloNccYI3zia9Qg"", ""date_range"": ""Jan 2019 - Jun 2019"", ""description"": ""Wrote a vehicle simulation from scratch in Simulink to model straight line movement of a racecar. The model contains suspension, load transfer, 6 DOF tire model, rolling resistance, aerodynamics, brakes, motors, and the controls system.\nUsed the simulation to do preliminary design for launch controllers. \nResulted in Bachelor's degree thesis.  After graduation, wrote a companion simulation for cornering, with intent to combine the two in the future for a full autocross sim. Simulation Lead"", ""duration"": ""6 mos"", ""end_month"": 6, ""end_year"": 2019, ""is_current"": false, ""job_type"": """", ""location"": """", ""skills"": """", ""start_month"": 1, ""start_year"": 2019, ""title"": ""Simulation Lead""}, {""company"": ""MIT Motorsports"", ""company_id"": ""27117585"", ""company_linkedin_url"": ""https://www.linkedin.com/company/27117585"", ""company_logo_url"": ""https://media.licdn.com/dms/image/v2/D4E0BAQH_ornkC73C3w/company-logo_200_200/company-logo_200_200/0/1692246910340/mitmotorsports_logo?e=1739404800&v=beta&t=XvqkZ3PJpeoYflktiSFuYFOkviixxloNccYI3zia9Qg"", ""date_range"": ""Jun 2018 - Jun 2019"", ""description"": ""Designed, built, tested mechanical steering system\nModel vehicle behavior in steady state turn, find optimums and sensitivities Steering + Tire Lead Jun 2018 - Jun 2019 \u00b7 1 yr 1 mo"", ""duration"": ""1 yr 1 mo"", ""end_month"": 6, ""end_year"": 2019, ""is_current"": false, ""job_type"": """", ""location"": """", ""skills"": """", ""start_month"": 6, ""start_year"": 2018, ""title"": ""Steering + Tire Lead""}, {""company"": ""MIT Motorsports"", ""company_id"": ""27117585"", ""company_linkedin_url"": ""https://www.linkedin.com/company/27117585"", ""company_logo_url"": ""https://media.licdn.com/dms/image/v2/D4E0BAQH_ornkC73C3w/company-logo_200_200/company-logo_200_200/0/1692246910340/mitmotorsports_logo?e=1739404800&v=beta&t=XvqkZ3PJpeoYflktiSFuYFOkviixxloNccYI3zia9Qg"", ""date_range"": ""Jun 2018 - Jun 2019"", ""description"": ""Designed and machined low voltage electronics enclosures, packaged PCBs\nDesigned and manufactured low voltage wiring harness Enclosures + Harness Lead  Jun 2018 - Jun 2019 \u00b7 1 yr 1 mo"", ""duration"": ""1 yr 1 mo"", ""end_month"": 6, ""end_year"": 2019, ""is_current"": false, ""job_type"": """", ""location"": """", ""skills"": """", ""start_month"": 6, ""start_year"": 2018, ""title"": ""Enclosures + Harness Lead""}, {""company"": ""MIT Motorsports"", ""company_id"": ""27117585"", ""company_linkedin_url"": ""https://www.linkedin.com/company/27117585"", ""company_logo_url"": ""https://media.licdn.com/dms/image/v2/D4E0BAQH_ornkC73C3w/company-logo_200_200/company-logo_200_200/0/1692246910340/mitmotorsports_logo?e=1739404800&v=beta&t=XvqkZ3PJpeoYflktiSFuYFOkviixxloNccYI3zia9Qg"", ""date_range"": ""Jun 2017 - Jun 2018"", ""description"": ""Managed a team of 40 student engineers to design and build an electric racecar to place 1st in Acceleration and Autocross, 2nd in Skidpad\nResponsible for maintaining the engineering timeline\nResponsible for auxiliary functions including fundraising, budget, and recruitment/retention.\nOversee design and integration of mechanical and electrical subsystems. Team Captain Jun 2017 - Jun 2018 \u00b7 1 yr 1 mo"", ""duration"": ""1 yr 1 mo"", ""end_month"": 6, ""end_year"": 2018, ""is_current"": false, ""job_type"": """", ""location"": """", ""skills"": """", ""start_month"": 6, ""start_year"": 2017, ""title"": ""Team Captain""}, {""company"": ""MIT Motorsports"", ""company_id"": ""27117585"", ""company_linkedin_url"": ""https://www.linkedin.com/company/27117585"", ""company_logo_url"": ""https://media.licdn.com/dms/image/v2/D4E0BAQH_ornkC73C3w/company-logo_200_200/company-logo_200_200/0/1692246910340/mitmotorsports_logo?e=1739404800&v=beta&t=XvqkZ3PJpeoYflktiSFuYFOkviixxloNccYI3zia9Qg"", ""date_range"": ""Jun 2016 - Jun 2017"", ""description"": ""Designed a steel spaceframe for an FSAE car.\nPerformed Finite Element Analysis with Autodesk Nastran In-CAD optimizing for stiffness and weight.\nDesigned and built an adjustable driver positioning jig to find the center of gravity of a driver for a range of seat angles.\nPackaged suspension components for a smaller tire size, new powertrain package, and custom battery pack in the frame for a 53% rear weight bias.\nDesigned and manufactured a jig to locate suspension point tabs for welding Chassis Lead Jun 2016 - Jun 2017 \u00b7 1 yr 1 mo"", ""duration"": ""1 yr 1 mo"", ""end_month"": 6, ""end_year"": 2017, ""is_current"": false, ""job_type"": """", ""location"": """", ""skills"": """", ""start_month"": 6, ""start_year"": 2016, ""title"": ""Chassis Lead""}, {""company"": ""MIT Motorsports"", ""company_id"": ""27117585"", ""company_linkedin_url"": ""https://www.linkedin.com/company/27117585"", ""company_logo_url"": ""https://media.licdn.com/dms/image/v2/D4E0BAQH_ornkC73C3w/company-logo_200_200/company-logo_200_200/0/1692246910340/mitmotorsports_logo?e=1739404800&v=beta&t=XvqkZ3PJpeoYflktiSFuYFOkviixxloNccYI3zia9Qg"", ""date_range"": ""Sep 2015 - Jun 2016"", ""description"": ""CAD and CNC machining of suspension components Wheel Packages Team Member"", ""duration"": ""10 mos"", ""end_month"": 6, ""end_year"": 2016, ""is_current"": false, ""job_type"": """", ""location"": """", ""skills"": """", ""start_month"": 9, ""start_year"": 2015, ""title"": ""Wheel Packages Team Member""}, {""company"": ""SSL"", ""company_id"": ""166073"", ""company_linkedin_url"": ""https://www.linkedin.com/company/166073"", ""company_logo_url"": ""https://media.licdn.com/dms/image/v2/C4D0BAQFWxyZN1CCeKg/company-logo_200_200/company-logo_200_200/0/1631360165256/sslmda_logo?e=1739404800&v=beta&t=E9hHMCi3GfAVW-XNneNieRFJq5mUUb35dq9GwxyMcfU"", ""date_range"": ""Dec 2018 - Jan 2019"", ""description"": ""Designed a controller to unload excess momentum, for the WorldView Legion satellite\nModeling in Simulink and Matlab"", ""duration"": ""2 mos"", ""end_month"": 1, ""end_year"": 2019, ""is_current"": false, ""job_type"": """", ""location"": """", ""skills"": """", ""start_month"": 12, ""start_year"": 2018, ""title"": ""Intern - Dynamics & Controls Analysis""}, {""company"": ""SpaceX"", ""company_id"": ""30846"", ""company_linkedin_url"": ""https://www.linkedin.com/company/30846"", ""company_logo_url"": ""https://media.licdn.com/dms/image/v2/C560BAQEbqLQ-JE0vdQ/company-logo_200_200/company-logo_200_200/0/1630604387686/spacex_logo?e=1739404800&v=beta&t=JDMr1FBxIJz9YSv0njSCX5bYgA4VVs2SiOo2-qvKpwI"", ""date_range"": ""Jun 2018 - Aug 2018"", ""description"": ""Designed and released GSE tooling for Falcon Heavy\nResponsible for releasing and and sourcing custom fasteners for Falcon Heavy"", ""duration"": ""3 mos"", ""end_month"": 8, ""end_year"": 2018, ""is_current"": false, ""job_type"": """", ""location"": ""Hawthorne, CA"", ""skills"": """", ""start_month"": 6, ""start_year"": 2018, ""title"": ""Vehicle Engineering Intern""}, {""company"": ""NASA Jet Propulsion Laboratory"", ""company_id"": ""2004"", ""company_linkedin_url"": ""https://www.linkedin.com/company/2004"", ""company_logo_url"": ""https://media.licdn.com/dms/image/v2/C4E0BAQFru17MYnHlaQ/company-logo_200_200/company-logo_200_200/0/1631325414149?e=1739404800&v=beta&t=2z7gh-3IYoX5BeqijmnQmFvN8DbTqguzwsP0TviFXRQ"", ""date_range"": ""May 2017 - Aug 2017"", ""description"": ""325B Entry Descent & Landing: \nDesigned and built a test fixture, similar to a horizontal desktop-scale Instron, to perform pull tests on parachute fabric test articles.\n\nMars 2020 Telecom\nPerformed thermal analysis of electronics cold plate, using Thermal Desktop. \nSupported ground support equipment engineering."", ""duration"": ""4 mos"", ""end_month"": 8, ""end_year"": 2017, ""is_current"": false, ""job_type"": """", ""location"": ""Pasadena, CA"", ""skills"": """", ""start_month"": 5, ""start_year"": 2017, ""title"": ""Engineering Intern""}, {""company"": ""Atlas Devices, LLC"", ""company_id"": ""10293997"", ""company_linkedin_url"": ""https://www.linkedin.com/company/10293997"", ""company_logo_url"": ""https://media.licdn.com/dms/image/v2/C4D0BAQHBZmOq63LPSg/company-logo_200_200/company-logo_200_200/0/1630528699572/atlas_devices_llc_logo?e=1739404800&v=beta&t=aw6NpUPLsLg8-LKKDc0VJpEcvlA7FW6g_MFR3xxp0HU"", ""date_range"": ""Jan 2017 - Feb 2017"", ""description"": ""Used rapid prototyping and mechanical tools to create a functional proof-of-concept prototype.\nOwned CAD of parts designed in Solidworks and integrated them into existing CAD assemblies.\nAssisted with manufacturing, assembly, and quality control testing for the APA-5 Ascender."", ""duration"": ""2 mos"", ""end_month"": 2, ""end_year"": 2017, ""is_current"": false, ""job_type"": """", ""location"": ""Cambridge, MA"", ""skills"": """", ""start_month"": 1, ""start_year"": 2017, ""title"": ""Engineering intern""}, {""company"": ""MIT Sloan Automotive Lab"", ""company_id"": """", ""company_linkedin_url"": """", ""company_logo_url"": """", ""date_range"": ""Jun 2016 - Aug 2016"", ""description"": ""Worked on cooling and electrical systems for a floating liner engine.  Designed and implemented a servo-driven system for throttle control.  Performed tests and maintenance on the engine."", ""duration"": ""3 mos"", ""end_month"": 8, ""end_year"": 2016, ""is_current"": false, ""job_type"": """", ""location"": """", ""skills"": """", ""start_month"": 6, ""start_year"": 2016, ""title"": ""Undergraduate Research Assistant""}, {""company"": ""MIT Media Lab"", ""company_id"": ""1499"", ""company_linkedin_url"": ""https://www.linkedin.com/company/1499"", ""company_logo_url"": ""https://media.licdn.com/dms/image/v2/C560BAQEEH3CNoBAf9g/company-logo_200_200/company-logo_200_200/0/1675453512122/mit_media_lab_logo?e=1739404800&v=beta&t=m157w0k1rNhJjLlyhUcTMFUVh49oIr5nVzf6vnAWi80"", ""date_range"": ""Mar 2016 - May 2016"", ""description"": ""Worked on testing and packaging of mobile robotic jewelry under Cindy Hsin-Liu Kao (PI Dr. Chris Schmandt)"", ""duration"": ""3 mos"", ""end_month"": 5, ""end_year"": 2016, ""is_current"": false, ""job_type"": """", ""location"": ""Living Mobile Group"", ""skills"": """", ""start_month"": 3, ""start_year"": 2016, ""title"": ""Undergraduate Researcher""}]}",https://www.linkedin.com/in/cheyenne-hua/,Mechanical Engineering,Ms. Cheyenne D Hua
'12,"[""SB - Bachelor Of Science""]","{""company"": ""Vicarious Surgical Inc."", ""company_description"": ""At Vicarious Surgical we are revolutionizing the field of surgical robotics. We seek to improve the lives of patients, enhance the ability of surgeons, and expand worldwide access to high-quality care through the use of surgical robotics. We have reimagined what is possible by building a human-like surgical robot and combining it with the world\u2019s first virtual-reality surgical camera to allow surgeons to perform minimally-invasive surgery with the ease of an open procedure."", ""company_industry"": ""Medical Equipment Manufacturing"", ""company_website"": ""http://www.vicarioussurgical.com"", ""experiences"": [{""company"": ""Vicarious Surgical Inc."", ""company_id"": ""27247773"", ""company_linkedin_url"": ""https://www.linkedin.com/company/27247773"", ""company_logo_url"": ""https://media.licdn.com/dms/image/v2/C4E0BAQHz6oPrJFGFNw/company-logo_200_200/company-logo_200_200/0/1630577951954/vicarious_surgical_logo?e=1739404800&v=beta&t=r4knOFBQMCIQazUrCt1h4r8-Wu_vyOmsnwJQA8ckt6c"", ""date_range"": ""May 2015 - Present"", ""description"": """", ""duration"": ""9 yrs 7 mos"", ""end_month"": """", ""end_year"": """", ""is_current"": true, ""job_type"": """", ""location"": ""Cambridge, MA"", ""skills"": """", ""start_month"": 5, ""start_year"": 2015, ""title"": ""Co-Founder and CTO""}, {""company"": ""Apple"", ""company_id"": ""162479"", ""company_linkedin_url"": ""https://www.linkedin.com/company/162479"", ""company_logo_url"": ""https://media.licdn.com/dms/image/v2/C560BAQHdAaarsO-eyA/company-logo_200_200/company-logo_200_200/0/1630637844948/apple_logo?e=1739404800&v=beta&t=Btf3_f7LuNLa_kxc2UJsAWL-zZOvBrIkYU5bXAL5gag"", ""date_range"": ""Dec 2013 - May 2015"", ""description"": """", ""duration"": ""1 yr 6 mos"", ""end_month"": 5, ""end_year"": 2015, ""is_current"": false, ""job_type"": """", ""location"": ""Cupertino, CA"", ""skills"": """", ""start_month"": 12, ""start_year"": 2013, ""title"": ""Product Design Engineer""}, {""company"": ""Hemedex, Inc."", ""company_id"": ""81809"", ""company_linkedin_url"": ""https://www.linkedin.com/company/81809"", ""company_logo_url"": ""https://media.licdn.com/dms/image/v2/C4E0BAQFmGVeRmGzJgg/company-logo_200_200/company-logo_200_200/0/1631329592989?e=1739404800&v=beta&t=ppbKOkDm8mnUQ2v20pSXoK0JMq0ooE8vu9yRFu6a5TE"", ""date_range"": ""Jun 2012 - Nov 2013"", ""description"": ""-Mechanical design aspects of the Bowman Perfusion Monitor (A device that measures blood flow in the brain).\n-Design for manufacturing of the chassis, plastic components and packaging of above monitor.\n-Design for manufacturing of fixturing devices and accessories such as cranial bolts\n-Testing and validation of components"", ""duration"": ""1 yr 6 mos"", ""end_month"": 11, ""end_year"": 2013, ""is_current"": false, ""job_type"": """", ""location"": ""Cambridge, MA"", ""skills"": """", ""start_month"": 6, ""start_year"": 2012, ""title"": ""Biomedical Design Engineer""}, {""company"": ""MIT Motorsports Team"", ""company_id"": ""1503"", ""company_linkedin_url"": ""https://www.linkedin.com/company/1503"", ""company_logo_url"": ""https://media.licdn.com/dms/image/v2/D560BAQH-UXRfIDIKug/company-logo_200_200/company-logo_200_200/0/1689799729035/mit_logo?e=1739404800&v=beta&t=tEpTamijC078EwkaaqSufDl_uX_12DP9KEv9Mcn4neA"", ""date_range"": ""Sep 2009 - Jun 2012"", ""description"": """", ""duration"": ""2 yrs 10 mos"", ""end_month"": 6, ""end_year"": 2012, ""is_current"": false, ""job_type"": """", ""location"": ""Cambridge, MA"", ""skills"": """", ""start_month"": 9, ""start_year"": 2009, ""title"": ""Competition Leader and Engineer""}]}",https://www.linkedin.com/in/sammy-khalifa-a7804761/,Mechanical Engineering,Mr. Sammy M Khalifa
